{
  "schema_version": 1,
  "case_set_id": "video-overlay-v1",
  "status": "reference_expectations_not_produced_by_an_openbar_implementation",
  "description": "Synthetic reference cases for the video playback and bar-path overlay design contract (docs/validation/VIDEO_OVERLAY_CONTRACT.md): display transform, timeline binding and frame lookup, path runs, and rep navigation. Expectations are hand-derived engineering references, not produced by an OpenBar implementation and not accuracy evidence.",
  "constants": {
    "timeline_binding_tolerance_us": 1,
    "raster_tolerance_px": 1
  },
  "transform_cases": [
    {
      "id": "landscape-exact-fit-half-scale",
      "description": "1920x1080 analysis drawn into a 960x540 view: scale 0.5, no bars. The frame corners are geometry probes (the outer edges of the first and last pixel), not valid observations.",
      "analysis": {
        "display_width_px": 1920,
        "display_height_px": 1080,
        "source_sha256_present": true
      },
      "video": {
        "coded_width_px": 1920,
        "coded_height_px": 1080,
        "source_rotation_deg": 0,
        "sample_aspect_ratio": [1, 1]
      },
      "player": {
        "raster_width_px": 1920,
        "raster_height_px": 1080,
        "applied_rotation_deg": 0,
        "conformance_pass": false
      },
      "view": {
        "width_px": 960,
        "height_px": 540,
        "zoom": 1,
        "pan_x_px": 0,
        "pan_y_px": 0
      },
      "expected_status": "accepted",
      "expected_scale": 0.5,
      "expected_content_rect": {
        "left_px": 0,
        "top_px": 0,
        "width_px": 960,
        "height_px": 540
      },
      "points": [
        {
          "display_px": [0, 0],
          "probe": "observation",
          "screen_px": [0.25, 0.25]
        },
        {
          "display_px": [1919, 1079],
          "probe": "observation",
          "screen_px": [959.75, 539.75]
        },
        {
          "display_px": [960, 540],
          "probe": "observation",
          "screen_px": [480.25, 270.25]
        },
        {
          "display_px": [-0.5, -0.5],
          "probe": "geometry_probe",
          "screen_px": [0, 0]
        },
        {
          "display_px": [1919.5, 1079.5],
          "probe": "geometry_probe",
          "screen_px": [960, 540]
        }
      ]
    },
    {
      "id": "landscape-in-portrait-view-letterbox",
      "description": "Landscape analysis in a 1080x2400 portrait view: width-limited scale 0.5625, bars above and below.",
      "analysis": {
        "display_width_px": 1920,
        "display_height_px": 1080,
        "source_sha256_present": true
      },
      "video": {
        "coded_width_px": 1920,
        "coded_height_px": 1080,
        "source_rotation_deg": 0,
        "sample_aspect_ratio": [1, 1]
      },
      "player": {
        "raster_width_px": 1920,
        "raster_height_px": 1080,
        "applied_rotation_deg": 0,
        "conformance_pass": false
      },
      "view": {
        "width_px": 1080,
        "height_px": 2400,
        "zoom": 1,
        "pan_x_px": 0,
        "pan_y_px": 0
      },
      "expected_status": "accepted",
      "expected_scale": 0.5625,
      "expected_content_rect": {
        "left_px": 0,
        "top_px": 896.25,
        "width_px": 1080,
        "height_px": 607.5
      },
      "points": [
        {
          "display_px": [0, 0],
          "probe": "observation",
          "screen_px": [0.28125, 896.53125]
        },
        {
          "display_px": [1919, 1079],
          "probe": "observation",
          "screen_px": [1079.71875, 1503.46875]
        },
        {
          "display_px": [960, 540],
          "probe": "observation",
          "screen_px": [540.28125, 1200.28125]
        }
      ]
    },
    {
      "id": "portrait-in-landscape-view-pillarbox",
      "description": "Portrait analysis in a 1920x1080 landscape view: height-limited scale 0.5625, bars left and right.",
      "analysis": {
        "display_width_px": 1080,
        "display_height_px": 1920,
        "source_sha256_present": true
      },
      "video": {
        "coded_width_px": 1080,
        "coded_height_px": 1920,
        "source_rotation_deg": 0,
        "sample_aspect_ratio": [1, 1]
      },
      "player": {
        "raster_width_px": 1080,
        "raster_height_px": 1920,
        "applied_rotation_deg": 0,
        "conformance_pass": false
      },
      "view": {
        "width_px": 1920,
        "height_px": 1080,
        "zoom": 1,
        "pan_x_px": 0,
        "pan_y_px": 0
      },
      "expected_status": "accepted",
      "expected_scale": 0.5625,
      "expected_content_rect": {
        "left_px": 656.25,
        "top_px": 0,
        "width_px": 607.5,
        "height_px": 1080
      },
      "points": [
        {
          "display_px": [0, 0],
          "probe": "observation",
          "screen_px": [656.53125, 0.28125]
        },
        {
          "display_px": [1079, 1919],
          "probe": "observation",
          "screen_px": [1263.46875, 1079.71875]
        },
        {
          "display_px": [540, 960],
          "probe": "observation",
          "screen_px": [960.28125, 540.28125]
        }
      ]
    },
    {
      "id": "portrait-native-no-rotation",
      "description": "720x1280 coded portrait recording with no rotation metadata, 360x640 view: scale 0.5.",
      "analysis": {
        "display_width_px": 720,
        "display_height_px": 1280,
        "source_sha256_present": true
      },
      "video": {
        "coded_width_px": 720,
        "coded_height_px": 1280,
        "source_rotation_deg": 0,
        "sample_aspect_ratio": [1, 1]
      },
      "player": {
        "raster_width_px": 720,
        "raster_height_px": 1280,
        "applied_rotation_deg": 0,
        "conformance_pass": false
      },
      "view": {
        "width_px": 360,
        "height_px": 640,
        "zoom": 1,
        "pan_x_px": 0,
        "pan_y_px": 0
      },
      "expected_status": "accepted",
      "expected_scale": 0.5,
      "expected_content_rect": {
        "left_px": 0,
        "top_px": 0,
        "width_px": 360,
        "height_px": 640
      },
      "points": [
        {
          "display_px": [0, 0],
          "probe": "observation",
          "screen_px": [0.25, 0.25]
        },
        {
          "display_px": [719, 1279],
          "probe": "observation",
          "screen_px": [359.75, 639.75]
        },
        {
          "display_px": [360, 640],
          "probe": "observation",
          "screen_px": [180.25, 320.25]
        }
      ]
    },
    {
      "id": "rotation-90-coded-landscape",
      "description": "1280x720 coded raster with source_rotation_deg 90: S1 is 720x1280. Coded pixels map through (cy, Wc-1-cx).",
      "analysis": {
        "display_width_px": 720,
        "display_height_px": 1280,
        "source_sha256_present": true
      },
      "video": {
        "coded_width_px": 1280,
        "coded_height_px": 720,
        "source_rotation_deg": 90,
        "sample_aspect_ratio": [1, 1]
      },
      "player": {
        "raster_width_px": 720,
        "raster_height_px": 1280,
        "applied_rotation_deg": 90,
        "conformance_pass": false
      },
      "view": {
        "width_px": 360,
        "height_px": 640,
        "zoom": 1,
        "pan_x_px": 0,
        "pan_y_px": 0
      },
      "expected_status": "accepted",
      "expected_scale": 0.5,
      "expected_content_rect": {
        "left_px": 0,
        "top_px": 0,
        "width_px": 360,
        "height_px": 640
      },
      "points": [
        {
          "coded_px": [1279, 0],
          "display_px": [0, 0],
          "probe": "observation",
          "screen_px": [0.25, 0.25]
        },
        {
          "coded_px": [0, 0],
          "display_px": [0, 1279],
          "probe": "observation",
          "screen_px": [0.25, 639.75]
        },
        {
          "coded_px": [0, 719],
          "display_px": [719, 1279],
          "probe": "observation",
          "screen_px": [359.75, 639.75]
        },
        {
          "coded_px": [1279, 719],
          "display_px": [719, 0],
          "probe": "observation",
          "screen_px": [359.75, 0.25]
        }
      ]
    },
    {
      "id": "rotation-180-coded-landscape",
      "description": "1280x720 coded raster with source_rotation_deg 180: S1 stays 1280x720, 640x360 view. Coded pixels map through (Wc-1-cx, Hc-1-cy).",
      "analysis": {
        "display_width_px": 1280,
        "display_height_px": 720,
        "source_sha256_present": true
      },
      "video": {
        "coded_width_px": 1280,
        "coded_height_px": 720,
        "source_rotation_deg": 180,
        "sample_aspect_ratio": [1, 1]
      },
      "player": {
        "raster_width_px": 1280,
        "raster_height_px": 720,
        "applied_rotation_deg": 180,
        "conformance_pass": false
      },
      "view": {
        "width_px": 640,
        "height_px": 360,
        "zoom": 1,
        "pan_x_px": 0,
        "pan_y_px": 0
      },
      "expected_status": "accepted",
      "expected_scale": 0.5,
      "expected_content_rect": {
        "left_px": 0,
        "top_px": 0,
        "width_px": 640,
        "height_px": 360
      },
      "points": [
        {
          "coded_px": [0, 0],
          "display_px": [1279, 719],
          "probe": "observation",
          "screen_px": [639.75, 359.75]
        },
        {
          "coded_px": [1279, 0],
          "display_px": [0, 719],
          "probe": "observation",
          "screen_px": [0.25, 359.75]
        },
        {
          "coded_px": [0, 719],
          "display_px": [1279, 0],
          "probe": "observation",
          "screen_px": [639.75, 0.25]
        },
        {
          "coded_px": [1279, 719],
          "display_px": [0, 0],
          "probe": "observation",
          "screen_px": [0.25, 0.25]
        }
      ]
    },
    {
      "id": "rotation-270-coded-landscape",